name,arguments,binary/valued,description
nodefactor,"(attrname, base=1)",binary,"Factor attribute effect: The attrnameargument is a character vector giving one or more names of categorical attributes in the network's vertex attribute list. This term adds multiple network statistics to the model, one for each of (a subset of) the unique values of the attrname attribute (or each combination of the attributes given). Each of these statistics gives the number of times a node with that attribute or those attributes appears in an edge in the network. In particular, for edges whose endpoints both have the same attribute values, this value is counted twice. To include all attribute values is usually not a good idea – though this may be accomplished if desired by setting base=0– because the sum of all such statistics equals twice the number of edges and hence a linear dependency would arise in any model also including edges. Thus, thebase argument tells which value(s) (numbered in order according to the sortfunction) should be omitted. The default value, base=1, means that the smallest (i.e., first in sorted order) attribute value is omitted. For example, if the “fruit” factor has levels “orange”, “apple”, “banana”, and “pear”, then to add just two terms, one for “apple” and one for “pear”, then set “banana” and “orange” to the base (remember to sort the values first) by usingnodefactor(""fruit"", base=2:3). For an analogous term for quantitative vertex attributes, see nodecov."
nodefactor,"(attrname, base=1, form=""sum"") ",valued,"Factor attribute effect: The attrnameargument is a character vector giving one or more names of categorical attributes in the network's vertex attribute list. This term adds multiple network statistics to the model, one for each of (a subset of) the unique values of the attrname attribute (or each combination of the attributes given). Each of these statistics gives the number of times a node with that attribute or those attributes appears in an edge in the network. In particular, for edges whose endpoints both have the same attribute values, this value is counted twice. To include all attribute values is usually not a good idea – though this may be accomplished if desired by setting base=0– because the sum of all such statistics equals twice the number of edges and hence a linear dependency would arise in any model also including edges. Thus, thebase argument tells which value(s) (numbered in order according to the sortfunction) should be omitted. The default value, base=1, means that the smallest (i.e., first in sorted order) attribute value is omitted. For example, if the “fruit” factor has levels “orange”, “apple”, “banana”, and “pear”, then to add just two terms, one for “apple” and one for “pear”, then set “banana” and “orange” to the base (remember to sort the values first) by usingnodefactor(""fruit"", base=2:3). For an analogous term for quantitative vertex attributes, see nodecov."
nodeicov,(attrname),binary,"Main effect of a covariate for in-edges: Theattrname argument is a character string giving the name of a numeric (not categorical) attribute in the network's vertex attribute list. This term adds a single network statistic to the model equaling the total value of attrname(j) for all edges(i,j) in the network. This term may only be used with directed networks. For categorical attributes, see nodeifactor."
nodeicov,"(attrname, form=""sum"")",valued,"Main effect of a covariate for in-edges: Theattrname argument is a character string giving the name of a numeric (not categorical) attribute in the network's vertex attribute list. This term adds a single network statistic to the model equaling the total value of attrname(j) for all edges(i,j) in the network. This term may only be used with directed networks. For categorical attributes, see nodeifactor."
nodeicovar,,valued,"Uncentered covariance of in-dyad values incident on each actor: This term adds one statistic equal to ?_{i,j,k} y_{k,j}y_{k,j}. This can be viewed as a valued analog of the istar(2) statistic."
nodeifactor,"(attrname, base=1)",binary,"Factor attribute effect for in-edges: Theattrname argument is a character vector giving one or more names of a categorical attribute in the network's vertex attribute list. This term adds multiple network statistics to the model, one for each of (a subset of) the unique values of theattrname attribute (or each combination of the attributes given). Each of these statistics gives the number of times a node with that attribute or those attributes appears as the terminal node of a directed tie. To include all attribute values is usually not a good idea – though this may be accomplished if desired by setting base=0– because the sum of all such statistics equals the number of edges and hence a linear dependency would arise in any model also including edges. Thus, the baseargument tells which value(s) (numbered in order according to the sort function) should be omitted. The default value,base=1, means that the smallest (i.e., first in sorted order) attribute value is omitted. For example, if the “fruit” factor has levels “orange”, “apple”, “banana”, and “pear”, then to add just two terms, one for “apple” and one for “pear”, then set “banana” and “orange” to the base (remember to sort the values first) by usingnodefactor(""fruit"", base=2:3). For an analogous term for quantitative vertex attributes, see nodeicov."
nodeifactor,"(attrname, base=1, form=""sum"")",valued,"Factor attribute effect for in-edges: Theattrname argument is a character vector giving one or more names of a categorical attribute in the network's vertex attribute list. This term adds multiple network statistics to the model, one for each of (a subset of) the unique values of theattrname attribute (or each combination of the attributes given). Each of these statistics gives the number of times a node with that attribute or those attributes appears as the terminal node of a directed tie. To include all attribute values is usually not a good idea – though this may be accomplished if desired by setting base=0– because the sum of all such statistics equals the number of edges and hence a linear dependency would arise in any model also including edges. Thus, thebase argument tells which value(s) (numbered in order according to the sortfunction) should be omitted. The default value, base=1, means that the smallest (i.e., first in sorted order) attribute value is omitted. For example, if the “fruit” factor has levels “orange”, “apple”, “banana”, and “pear”, then to add just two terms, one for “apple” and one for “pear”, then set “banana” and “orange” to the base (remember to sort the values first) by usingnodefactor(""fruit"", base=2:3). For an analogous term for quantitative vertex attributes, see nodeicov."
nodeisqrtcovar,,valued,"Uncentered covariance of square roots of in-dyad values incident on each actor: This term adds one statistic equal to ?_{i,j,k} ?{y_{i,j}}?{y_{k,j}}. This can be viewed as a valued analog of the istar(2) statistic."
nodematch,"(attrname, diff=FALSE, keep=NULL)",binary,"Uniform homophily and differential homophily: The attrname argument is a character vector giving one or more names of attributes in the network's vertex attribute list. When diff=FALSE, this term adds one network statistic to the model, which counts the number of edges (i,j) for whichattrname(i)==attrname(j). (When multiple names are given, the statistic counts only those on which all the named attributes match.) When diff=TRUE, pnetwork statistics are added to the model, where p is the number of unique values of the attrname attribute. The kth such statistic counts the number of edges (i,j) for which attrname(i) == attrname(j) == value(k), where value(k) is thekth smallest unique value of the attrname attribute. If set to non-NULL, the optionalkeep argument should be a vector of integers giving the values of k that should be considered for matches; other values are ignored (this works for both diff=FALSEand diff=TRUE). For instance, to add two statistics, counting the matches for just the 2nd and 4th categories, use nodematchwith diff=TRUE and keep=c(2,4)."
nodematch (a.k.a. match),"(attrname, diff=FALSE, keep=NULL, form=""sum"")",valued,"Uniform homophily and differential homophily: The attrname argument is a character vector giving one or more names of attributes in the network's vertex attribute list. When diff=FALSE, this term adds one network statistic to the model, which counts the number of edges(i,j) for whichattrname(i)==attrname(j). (When multiple names are given, the statistic counts only those on which all the named attributes match.) When diff=TRUE, pnetwork statistics are added to the model, where p is the number of unique values of the attrname attribute. The kth such statistic counts the number of edges (i,j)for which attrname(i) == attrname(j) == value(k), wherevalue(k) is the kth smallest unique value of the attrname attribute. If set to non-NULL, the optional keep argument should be a vector of integers giving the values of k that should be considered for matches; other values are ignored (this works for both diff=FALSE anddiff=TRUE). For instance, to add two statistics, counting the matches for just the 2nd and 4th categories, usenodematch with diff=TRUE andkeep=c(2,4)."
nodemix,"(attrname, base=NULL)",binary,"Nodal attribute mixing: The attrnameargument is a character vector giving the names of categorical attributes in the network's vertex attribute list. By default, this term adds one network statistic to the model for each possible pairing of attribute values. The statistic equals the number of edges in the network in which the nodes have that pairing of values. (When multiple names are given, a statistic is added for each combination of attribute values for those names.) In other words, this term produces one statistic for every entry in the mixing matrix for the attribute(s). The ordering of the attribute values is alphabetical (for nominal categories) or numerical (for ordered categories). The optional base argument is a vector of integers corresponding to the pairings that should not be included. If base contains only negative integers, then these integers correspond to the only pairings that should be included. By default (i.e., withbase=NULL or base=0), all pairings are included."
nodemix,"(attrname, base=NULL, form=""sum"")",valued,"Nodal attribute mixing: The attrnameargument is a character vector giving the names of categorical attributes in the network's vertex attribute list. By default, this term adds one network statistic to the model for each possible pairing of attribute values. The statistic equals the number of edges in the network in which the nodes have that pairing of values. (When multiple names are given, a statistic is added for each combination of attribute values for those names.) In other words, this term produces one statistic for every entry in the mixing matrix for the attribute(s). The ordering of the attribute values is alphabetical (for nominal categories) or numerical (for ordered categories). The optional base argument is a vector of integers corresponding to the pairings that should not be included. If base contains only negative integers, then these integers correspond to the only pairings that should be included. By default (i.e., withbase=NULL or base=0), all pairings are included."
nodeocov,(attrname),binary,"Main effect of a covariate for out-edges:The attrname argument is a character string giving the name of a numeric (not categorical) attribute in the network's vertex attribute list. This term adds a single network statistic to the model equaling the total value of attrname(i) for all edges(i,j) in the network. This term may only be used with directed networks. For categorical attributes, see nodeofactor."
nodeocov,"(attrname, form=""sum"")",valued,"Main effect of a covariate for out-edges:The attrname argument is a character string giving the name of a numeric (not categorical) attribute in the network's vertex attribute list. This term adds a single network statistic to the model equaling the total value of attrname(i) for all edges(i,j) in the network. This term may only be used with directed networks. For categorical attributes, see nodeofactor."
nodeocovar,,valued,"Uncentered covariance of out-dyad values incident on each actor: This term adds one statistic equal to ?_{i,j,k} y_{i,j}y_{i,k}. This can be viewed as a valued analog of theostar(2) statistic."
nodeofactor,"(attrname, base=1)",binary,"Factor attribute effect for out-edges: Theattrname argument is a character string giving one or more names of categorical attributes in the network's vertex attribute list. This term adds multiple network statistics to the model, one for each of (a subset of) the unique values of theattrname attribute (or each combination of the attributes given). Each of these statistics gives the number of times a node with that attribute or those attributes appears as the node of origin of a directed tie. To include all attribute values is usually not a good idea – though this may be accomplished if desired by setting base=0– because the sum of all such statistics equals the number of edges and hence a linear dependency would arise in any model also including edges. Thus, the baseargument tells which value(s) (numbered in order according to the sort function) should be omitted. The default value,base=1, means that the smallest (i.e., first in sorted order) attribute value is omitted. For example, if the “fruit” factor has levels “orange”, “apple”, “banana”, and “pear”, then to add just two terms, one for “apple” and one for “pear”, then set “banana” and “orange” to the base (remember to sort the values first) by usingnodefactor(""fruit"", base=2:3). For an analogous term for quantitative vertex attributes, see nodeocov."
nodeofactor,"(attrname, base=1, form=""sum"")",valued,"Factor attribute effect for out-edges: Theattrname argument is a character string giving one or more names of categorical attributes in the network's vertex attribute list. This term adds multiple network statistics to the model, one for each of (a subset of) the unique values of theattrname attribute (or each combination of the attributes given). Each of these statistics gives the number of times a node with that attribute or those attributes appears as the node of origin of a directed tie. To include all attribute values is usually not a good idea – though this may be accomplished if desired by setting base=0– because the sum of all such statistics equals the number of edges and hence a linear dependency would arise in any model also including edges. Thus, thebase argument tells which value(s) (numbered in order according to the sortfunction) should be omitted. The default value, base=1, means that the smallest (i.e., first in sorted order) attribute value is omitted. For example, if the “fruit” factor has levels “orange”, “apple”, “banana”, and “pear”, then to add just two terms, one for “apple” and one for “pear”, then set “banana” and “orange” to the base (remember to sort the values first) by usingnodefactor(""fruit"", base=2:3). For an analogous term for quantitative vertex attributes, see nodeocov."
nodeosqrtcovar ,,valued,"Uncentered covariance of square roots of out-dyad values incident on each actor:This term adds one statistic equal to?_{i,j,k} ?{y_{i,j}}?{y_{i,k}}. This can be viewed as a valued analog of theostar(2) statistic."
nodesqrtcovar,(center=TRUE),valued,"Covariance of square roots of dyad values incident on each actor: This term adds one statistic equal to ?_{i,j,k} (?{y_{i,j}}?{y_{i,k}}+?{y_{k,j}}?{y_{k,j}}) ifcenter=FALSE. This can be viewed as a valued analog of the kstar(2) statistic. Ifcenter=FALSE (the default), the statistic is instead ?_{i,j,k} ((?{y_{i,j}}-\bar{?{y}})(?{y_{i,k}}-\bar{?{y}})+(?{y_{k,j}}-\bar{?{y}})(?{y_{k,j}}-\bar{?{y}})), where \bar{?{y}} is the mean of the square root of dyad values."
nsp,(d),binary,"Nonedgewise shared partners: This is just like the dsp and esp terms, except this term adds one network statistic to the model for each element in d where the ith such statistic equals the number of non-edges (that is, dyads that do not have an edge) in the network with exactly d[i]shared partners. This term can be used with directed and undirected networks. For directed networks the count is over homogeneous shared partners only (i.e., only partners on a directed two-path connecting the nodes in the non-edge and in the same direction)."
odegrange,"(from, to=+Inf, by=NULL, homophily=FALSE)",binary,"Out-degree range: The from and toarguments are vectors of distinct integers (or +Inf, for to (its default)). If one of the vectors has length 1, it is recycled to the length of the other. Otherwise, they must have the same length. This term adds one network statistic to the model for each element of from (or to); the ith such statistic equals the number of nodes in the network of out-degree greater than or equal to from[i] but strictly less than to[i], i.e. with out-edge count in semiopen interval[from,to). The optional argument by is a character string giving the name of an attribute in the network's vertex attribute list. If this is specified and homophily isTRUE, then degrees are calculated using the subnetwork consisting of only edges whose endpoints have the same value of theby attribute. If by is specified andhomophily is FALSE (the default), then separate degree range statistics are calculated for nodes having each separate value of the attribute. This term can only be used with directed networks; for undirected networks (bipartite and not) see degrange. For degrees of specific modes of bipartite networks, see b1degrange and b2degrange. For in-degrees, see idegrange."
odegree,"(d, by=NULL, homophily=FALSE)",binary,"Out-degree: The d argument is a vector of distinct integers. This term adds one network statistic to the model for each element in d; the ith such statistic equals the number of nodes in the network of out-degree d[i], i.e. the number of nodes with exactly d[i] out-edges. The optional argument by is a character string giving the name of an attribute in the network's vertex attribute list. If this is specified andhomophily is TRUE, then degrees are calculated using the subnetwork consisting of only edges whose endpoints have the same value of the by attribute. If by is specified and homophily is FALSE (the default), then separate degree statistics are calculated for nodes having each separate value of the attribute. This term can only be used with directed networks; for undirected networks see degree."
odegreepopularity,,binary,"Out-degree popularity: This term adds one network statistic to the model equaling the sum over the actors of each actor's outdegree taken to the 3/2 power (or, equivalently, multiplied by its square root). This term is analogous to the term of Snijders et al. (2010), equation (12). This term can only be used with directed networks."
opentriad,,binary,“Open triads”: This term adds one statistic to the model equal to the number of 2-stars minus three times the number of triangles in the network. It is currently only implemented for undirected networks.
ostar,"(k, attrname=NULL)",binary,"k-Outstars: The k argument is a vector of distinct integers. This term adds one network statistic to the model for each element in k. The ith such statistic counts the number of distinct k[i]-outstars in the network, where a k-outstar is defined to be a node N and a set of k different nodes \{O_1, …, O_k\} such that the ties (N,O_j)exist for j=1, …, k. The optional argumentattrname is a character string giving the name of an attribute in the network's vertex attribute list. If this is specified then the count is the number of k-outstars where all nodes have the same value of the attribute. This term can only be used with directed networks; for undirected networks seekstar. Note that ostar(1) is equal to both istar(1) and edges."
receiver,(base=1),binary,"Receiver effect: This term adds one network statistic for each node equal to the number of in-ties for that node. This measures the popularity of the node. The term for the first node is omitted by default because of linear dependence that arises if this term is used together with edges, but its coefficient can be computed as the negative of the sum of the coefficients of all the other actors. That is, the average coefficient is zero, following the Holland-Leinhardt parametrization of the $p_1$ model (Holland and Leinhardt, 1981). Thebase argument allows the user to determine which nodes' statistics should be omitted. The base argument can also be a vector of negative indices, to specify which should be added instead of deleted, andbase=0 specifies that all statistics should be included. This term can only be used with directed networks. For undirected networks, see sociality."
sender,(base=1),binary,"Sender effect: This term adds one network statistic for each node equal to the number of out-ties for that node. This measures the activity of the node. The term for the first node is omitted by default because of linear dependence that arises if this term is used together with edges, but its coefficient can be computed as the negative of the sum of the coefficients of all the other actors. That is, the average coefficient is zero, following the Holland-Leinhardt parametrization of the $p_1$ model (Holland and Leinhardt, 1981). The base argument allows the user to determine which nodes' statistics should be omitted. The base argument can also be a vector of negative indices, to specify which should be added instead of deleted, andbase=0 specifies that all statistics should be included. This term can only be used with directed networks. For undirected networks, see sociality."
simmelian,,binary,"Simmelian triads: This term adds one statistic to the model equal to the number of Simmelian triads, as defined by Krackhardt and Handcock (2007). This is a complete sub-graph of size three. This term can only be used with directed networks."
simmelianties,,binary,"Ties in simmelian triads: This term adds one statistic to the model equal to the number of ties in the network that are associated with Simmelian triads, as defined by Krackhardt and Handcock (2007). Each Simmelian has six ties in it but, because Simmelians can overlap in terms of nodes (and associated ties), the total number of ties in these Simmelians is less than six times the number of Simmelians. Hence this is a measure of the clustering of Simmelians (given the number of Simmelians). This term can only be used with directed networks."
smalldiff,"(attrname, cutoff)",binary,"Number of ties between actors with similar (but not necessarily identical) attribute values: The attrname argument is a character string giving the name of a quantitative attribute in the network's vertex attribute list. This term adds one statistic, having as its value the number of edges in the network for which the incident actors' attribute values differ less than cotoff; that is, number of edges between i to jsuch that abs(attrname[i]-attrname[j])<cutoff."
sociality,"(attrname=NULL, base=1)",binary,"Undirected degree: This term adds one network statistic for each node equal to the number of ties of that node. The optionalattrname argument is a character string giving the name of an attribute in the network's vertex attribute list that takes categorical values. If provided, this term only counts ties between nodes with the same value of the attribute (an actor-specific version of the nodematch term). This term can only be used with undirected networks. For directed networks, seesender and receiver. By default,base=1 means that the statistic for the first node will be omitted, but this argument may be changed to control which statistics are included just as for the sender andreceiver terms."
sum,(pow=1),valued,"Sum of dyad values (optionally taken to a power): This term adds one statistic equal to the sum of dyad values taken to the power pow, which defaults to 1."
threepath,(keep=1:4),binary,"Three-paths: For an undirected network, this term adds one statistic equal to the number of threepaths, where a threepath is defined as a path of length three that traverses three distinct edges. Note that a threepath need not include four distinct nodes; in particular, a triangle counts as three threepaths. For a directed network, this term adds four statistics (or some subset of these four specified by the keepargument), one for each of the four distinct types of directed three-paths. If the nodes of the path are written from left to right such that the middle edge points to the right (R), then the four types are RRR, RRL, LRR, and LRL. That is, an RRR threepath is of the form i-->j-->k-->l, and RRL threepath is of the form i-->j-->k<--l, etc. Like in the undirected case, there is no requirement that the nodes be distinct in a directed threepath. However, the three edges must all be distinct. Thus, a mutual tie i<-->jdoes not count as a threepath of the form i-->j-->i<--j; however, in the subnetwork i<-->j-->k, there are two directed threepaths, one LRR (k<--j-->i-->j) and one RRR (k<--j-->i-->j)."
