name,arguments,binary/valued,description
transitive,,binary,"Transitive triads: This term adds one statistic to the model, equal to the number of triads in the network that are transitive. The transitive triads are those of type 120D,030T, 120U, or 300 in the categorization of Davis and Leinhardt (1972). For details on the 16 possible triad types, seetriad.classify in the sna package. Note the distinction from the ttripleterm. This term can only be used with directed networks."
transitiveties,(attrname=NULL),binary,"Transitive ties: This term adds one statistic, equal to the number of ties i-->j such that there exists a two-path from i to j. (Related to the ttriple term.) The binary version takes a nodal attribute attrname, and, if given, all three nodes involved (i, j, and the node on the two-path) must match on this attribute in order for i-->j to be counted. The binary version of this term can only be used with directed networks. The valued version can be used with both directed and undirected."
transitiveties,(threshold=0),valued,"Transitive ties: This term adds one statistic, equal to the number of ties i-->jsuch that there exists a two-path from i toj. (Related to the ttriple term.) The binary version takes a nodal attributeattrname, and, if given, all three nodes involved (i, j, and the node on the two-path) must match on this attribute in order for i-->j to be counted. The binary version of this term can only be used with directed networks. The valued version can be used with both directed and undirected."
transitiveweights,"(twopath=""min"",combine=""max"",affect=""min"")",valued,"Transitive weights: This statistic implements the transitive weights statistic defined by Krivitsky (2012), Equation 13. The currently implemented options fortwopath is the minimum of the constituent dyads (""min"") or their geometric mean (""geomean""); forcombine, the maximum of the 2-path strengths (""max"") or their sum (""sum""); and for affect, the minimum of the focus dyad and the combined strength of the two paths (""min"") or their geometric mean (""geomean""). For each of these options, the first (and the default) is more stable but also more conservative, while the second is more sensitive but more likely to induce a multimodal distribution of networks."
triadcensus,(d),binary,"Triad census: For a directed network, this term adds one network statistic for each of an arbitrary subset of the 16 possible types of triads categorized by Davis and Leinhardt (1972) as 003, 012, 102, 021D, 021U, 021C, 111D, 111U, 030T, 030C, 201, 120D, 120U, 120C, 210, and 300. Note that at least one category should be dropped; otherwise a linear dependency will exist among the 16 statistics, since they must sum to the total number of three-node sets. By default, the category 003, which is the category of completely empty three-node sets, is dropped. This is considered category zero, and the others are numbered 1 through 15 in the order given above. By specifying a numeric vector of integers from 0 to 15 as the d argument, the user may specify a set of terms to add other than the default value of 1:15. Each statistic is the count of the corresponding triad type in the network. For details on the 16 types, see ?triad.classify in the {sna} package, on which this code is based. For an undirected network, the triad census is over the four types defined by the number of ties (i.e., 0, 1, 2, and 3), and the default is to add 1:3, which is to say that the 0 is dropped; however, this too may be controlled by changing the d argument to a numeric vector giving a subset of \{0, 1, 2, 3\}."
triangle,(attrname=NULL),binary,"Triangles: This term adds one statistic to the model equal to the number of triangles in the network. For an undirected network, a triangle is defined to be any set \{(i,j), (j,k), (k,i)\} of three edges. For a directed network, a triangle is defined as any set of three edges (i,j) and (j,k) and either (k,i) or(i,k). The former case is called a “transitive triple” and the latter is called a “cyclic triple”, so in the case of a directed network,triangle equals ttriple plus ctriple— thus at most two of these three terms can be in a model. The optional argumentattrname restricts the count to those triples of nodes with equal values of the vertex attribute specified by attrname."
tripercent,(attrname=NULL) ,binary,"Triangle percentage: This term adds one statistic to the model equal to 100 times the ratio of the number of triangles in the network to the sum of the number of triangles and the number of 2-stars not in triangles (the latter is considered a potential but incomplete triangle). In case the denominator equals zero, the statistic is defined to be zero. For the definition of triangle, see triangle. The optional argument attrname restricts the counts (both numerator and denominator) to those triples of nodes with equal values of the vertex attribute specified by attrname. This is often called the mean correlation coefficient. This term can only be used with undirected networks; for directed networks, it is difficult to define the numerator and denominator in a consistent and meaningful way."
ttriple,"(attrname=NULL, a.k.a. ttriad)",binary,"Transitive triples: This term adds one statistic to the model, equal to the number of transitive triples in the network, defined as a set of edges {(i,j), (j,k), (i,k)}. Note thattriangle equals ttriple+ctriple for a directed network, so at most two of the three terms can be in a model. The optional argument attrname is a character string giving the name of an attribute in the network's vertex attribute list. If this is specified then the count is over the number of transitive triples where all three nodes have the same value of the attribute. This term can only be used with directed networks."
twopath,,binary,"2-Paths: This term adds one statistic to the model, equal to the number of 2-paths in the network. For a directed network this is defined as a pair of edges (i,j), (j,k), where iand j must be distinct. That is, it is a directed path of length 2 from i to k via j. For directed networks a 2-path is also a mixed 2-star but the interpretation is usually different; see m2star. For undirected networks a twopath is defined as a pair of edges \{i,j\}, \{j,k\}. That is, it is an undirected path of length 2 from i to k via j, also known as a 2-star."
